title,pos_text,neg_text,ratingValue,bestRating,hotel
"привітний персонал, розташування до центру, смачна кухня, ...","привітний персонал, розташування до центру, смачна кухня, пиво та рок (на живу музику не потрапила, а на великий екран - транслювали супер) Поруч є також їдальня, дешево і смачно.","1) Душ верхній як такий сам по собі (але це я не люблю такий), 2) розтріскується (дірочки не чищенні добре )",9.6,10.0,ungweiser.uk.html
Негативне враження створене абсолютною неповагою до відпочинку проживаючих.,"Хороше розташування, чисто . Дівчинка адміністратор яка працює вдень дуже ввічлива.","Номер чистий, але стіни язні, напевно попередні мешканці по них погуляли, дівчинка яка заселила сказала що це нормально . Вночі працює ремонтна бригада перфоратором і молотком, до 2.05 ночі поки я не зробила зауваження на яке зреагували не відразу так як мені було повідомлено що нічого не можуть зробити тому що "" так сказав директор "" на прохання покликати директора сказали що його немає, зателефонувати ми не можемо тому що ніч!!!! Тобто, "" директор "" спить, а я клієнт який заплатив кошти за проживання не спить, а слухає як працює перфоратор . Комфорт мінімальний.",6.3,10.0,ungweiser.uk.html
"нетвереза компанія вчинила розбірки під вікнами номера, дуже...",Nan,"нетвереза компанія вчинила розбірки під вікнами номера, дуже гучна музика в нічний час на території готелю, яку чути в номері, низька шумоізоляція. Хоча виселення об 11.00 картка на відкривання дверей о 10.50 вже не працювала...",6.7,10.0,ungweiser.uk.html
"Гарний персонал, гарний ресторан, все смачно було","Гарний персонал, гарний ресторан, все смачно було","Не дивлячись на те, що в хотели є ресторан, в номері повинні бути чайник електро і холодильник, ми були с дітьми і було дуже без цих речей не комфортно, і прибирання повинно бути завжди, а не тоді коли ми цього попросимо",5.8,10.0,ungweiser.uk.html
Загалом непогано. Ввечері може бути шум від відвідувачів пабу. Вирішується закриттям вікна.,"Готель знаходить в 10 хвилинах ходьби від центральної частини міста . При поселенні в готель 10% знижка у пабі, що є досить зручно . Є кондиціонер.","Досить тонкі стіни і ми чули хропіння із сусіднього номеру . Оскільки готель знаходиться над Пабон, шум і музика можуть заважати.",7.9,10.0,ungweiser.uk.html
"Номер сподобався, музика була чутна до 3 годин ночі, але нам...","Номер сподобався, музика була чутна до 3 годин ночі, але нам це не завадило . Після прогулянки чудовим містом та вечері в ресторані на першому поверсі відпочивало добре.",Nan,8.3,10.0,ungweiser.uk.html
Жахливий готель! Не рекомендую нікому отримати схожий досвід! Booking має бандити такі готелі!,"Все було на дуже низькому рівні!  Невідповідність між фото, описом та реальністю!","- матраци та покривала були з клопами!!! (фото додано), як результат нам прийшлось виселятися о 4 ій ранку і шукати інший готель, через те що в кімнаті не можливо було знаходитись! - Персоналу просто немає, і коли ми вночі вирішили повідомити про проблему то охорона не знає кому належить цей готель і немає ніяких контактів . А Букін номер відповідав! - Рушники були порвані і в плямах - До їхньої ночі в барі була дискотека після чого приїхала поліція і пробувала розігнати п'яних людей, що їм не вдалось",3.3,10.0,ungweiser.uk.html
"Вдале розташування, смачне пиво та кухня . Рекомендую!","Добре розташування, близько до набережної і пішохідного мосту. Внизу, під готелем є ресторація де варять своє смачне пиво та є добра кухня. Дуже сподобалась їхня піца. Дають 10% знижки на пиво коли проживаєш у них.",малюсінькі номер,8.8,10.0,ungweiser.uk.html
"Паб зразу на першому поверсі, смачне пиво.","Паб зразу на першому поверсі, смачне пиво. Близько до центру.",шумні компанії на вулиці до пізньої ночі . Полювання за комарами . Постіль напевне синтетична - спекотно спати.,7.1,10.0,ungweiser.uk.html
Гарний Отель,"Отель знаходиться над кафе з власною броварнею. Тут можна смачно поїсти, попити і відпочити. Зовсім поруч «старе місто». Зручно.",шумоізоляція трохи неуважна (,10.0,10.0,ungweiser.uk.html
"Привітний персонал, місцерозташування, смачне пиво","Привітний персонал, місцерозташування, смачне пиво","Безліч комарів, не працював кондиціонер та алігатори, виливається вода з душу, мало одного віконця у стелі",7.9,10.0,ungweiser.uk.html
"Тиха вуличка у самому центрі, можна спати з відкритим вікном...","Тиха вуличка у самому центрі, можна спати з відкритим вікном (але не забувати вмикати відлякував комарів!). Чудове нафтове пиво зі знижкою для мешканців готелю . приязний персонал . У кімнаті ідеально чисто.","Не було великих рушників, тільки два малих. Батарейки у пульті кондиціонера треба хоч інколи замінювати. Сніданок, як на мене, починається запізно - о дев'ятій ранку.",8.8,10.0,ungweiser.uk.html
"Зручний, оптимальний за ціною та розташуванням. Для тих, хто не звик засиджуватися у номері готелі.","Розташування оптимальне для тих, хто хоче ще подорожувати з Ужгорода - пішки можна дістатись і до автовокзалу, і до залізничного вокзалу. Привітний персонал, в усіх проханнях йшли на зустріч. Сам готель затишний, спокійний.","Проблеми з душем, було б набагато зручніше, якби Лейка душу була зі шлангом . Лейка наразі відрегульована, тому після прийняття душу доводиться ще прибирати воду з підлоги, бо шторка не захищає від протікання.",8.8,10.0,ungweiser.uk.html
комфортні матраци.,комфортні матраци . Розташування готелю зручне . Працював кондиціонер і це врятувало від спеки в мансарді.,"Душ працював погано, все було у воді . Рушники поняли хлоркою . Не працював антивоєнний пристрій . Якщо жити довго - нема де розкласти речі та розвісити одяг, особливо, якщо подорожувати удвох . А в ресторані при готелі - абсолютно негазована пиво і їжа, яку можна їсти через одне блюдо ....",5.8,10.0,ungweiser.uk.html
"В цілому, задоволені вибором готелю.","В цілому, задоволені вибором готелю. Хороше співвідношення ціни та якості.","Не було можливості вранці випити каву, оскільки нам сказали, що бар відкривається в 11.00",9.2,10.0,ungweiser.uk.html
Персонал працює швидко і без зайвих запитань.,"Персонал працює швидко і без зайвих запитань. Можна припаркувати автомобіль перед готелем. До центру міста 10 хвилин пішки. В номері чисто, є все потрібне. Номер невеликий, але і ціна невисока.",Nan,8.8,10.0,ungweiser.uk.html
Саме головне в готелі- тихо.,"Тихий, затишний готель з невеликими кімнатами.","постільна білизна це жах . порвана та брудна . Душ не зручний . полотен замало, та в жахливому стані, порвані, брудні.",6.7,10.0,ungweiser.uk.html
"сучасно, неохайно, незручно.",Розташування,"малесенька кімнатка з одним вікном у стелі до якого не дістати щоб відкрити, навіть якщо стати на стілець . Душно, темно . Душ у стелі, з якого періодично капає . Вночі гучно грає ватні - совкова музика в клубі що поруч.",5.0,10.0,ungweiser.uk.html
Розташування зручне.,Розташування зручне. Паб.,"Брудно в номері, пильно, стіни з плямами, телевізор не працює нормально. На двох дають 3 рушники, немає чайника, дуже мало місця.",5.8,10.0,ungweiser.uk.html
Розташування - супер!,"Розташування - супер! В центрі міста. Можлива парковка перед готелем. Привітний персонал, смачна їжа.","Готель вже потребує ремонту: стіни затерті, постіль на додатковому місці з плямами. Але найбільше, що вразило - пилу на ""два пальці"". Причому повсюду. Пульти від телевізору, тумби, стіл і т. д. Готель вже не такий, як рік чи півтора назад.",6.3,10.0,ungweiser.uk.html
Хороше розташування!,"Готель легко знайти, недалеко від авто і зал . вокзалів . Чиста комфортна постіль, досить просторий чистий санвузол, є фен . У пабі знизу смачне пиво . Електронна система ключів.","Крихітний номер з вікном у стелі, яке важко відчинити, маючи табурет, який ось - ось розсиплеться . У номері #5 не працює кондиціонер, в пульті сіли батарейки . ду-у-уже маленькі рушники, та й він один на всі "" участки тела "" . Немає склянок / чашок.",7.9,10.0,ungweiser.uk.html
рекомендуємо в меню прописати більш детально дегустаційний сет,"розташування хороше, до центру рукою подати. сніданок ситний і досить смачна кава)","не зовсім зрозуміло на що розповсюджується знижка у пабі.. при поселенні сказали, що будемо мати знижку 10%, як мешканці.. по факту офіціант повідомив,що знижка не діє.. зробив нам знижку 1 гривню на дегустаційний бокал пива..",8.3,10.0,ungweiser.uk.html
"Білосніжна постіль і рушники, зручне ліжко, кондиціонер,...","Білосніжна постіль і рушники, зручне ліжко, кондиціонер, ресторан на першому поверсі готелю, смачне пиво власного виробництва+знижка для проживаючих. Зручне розташування, близько до всіх туристичних локацій. Рекомендую","Не зовсім зручний душ в стелі . Так як кімната маленька дуже швидко стає душно, тому вікно цілодобово відчинене і все добре, якби воно виходило у двір, а так вечері чути крики п'яних компаній, а вранці будить шум дороги і ду-у-уже раннє прибирання покоївки у сусідніх номерах, хоча час виселення 11.00",8.8,10.0,ungweiser.uk.html
"Компактний номер, нічого зайвого.","Компактний номер, нічого зайвого.","В номері не було змінного взуття (одноразових тапочок), після виходу з душу не було в чому ходити по номеру. Також дуже погана звукоізоляція, що заважало нормально відпочити.",7.5,10.0,ungweiser.uk.html
Бюджетний готель у центрі міста для короткого перебування в Ужгороді,"Готель розташований у центрі, дуже близько до найцікавіших місць Ужгорода . Досить затишно і тихо, не дивлячись на паб за стіною готелю . Сподобалось мансардний розташування кімнати, наявність кондиціонера та фену у номері, чиста білосніжна постіль, історичні фото Ужгорода на стінах . привітний персонал . Велике дзеркало у ванній, досить зручне ліжко.","Дуже незручний душ, який тече зі стелі, потім вся підлога у ванній мокра, і шторка не допомагає. Є лише один рушник, середнього розміру. Ми забронювали номер на дві ночі, а косметичні засоби (шампунь і мило) були лише на одну.  Ванна кімната мала б бути чистішою, в кутках підлоги був пил. Телевізор у нашому номері чомусь не працював.",7.5,10.0,ungweiser.uk.html
"Персонал хороший, в ресторані смачно годують","Персонал хороший, в ресторані смачно годують","Трохи більше удіяти прибиранню, полотен були не чисті в жовтих пятна, а душ не знімався коли миється то намокає голова це не удобно",7.1,10.0,ungweiser.uk.html
"Відмінне місцерозташування, чистота у номері, жахлива звукоізоляція.","Відмінне розташування готелю у самому центрі міста. Чистота у номері та ванній кімнаті, білосніжна та свіжа білизна.","Жахлива звукоізоляція . Вночі майже не вдавалося відпочити через музичні концерти, які відбувалися поверхом нижче у ресторані даного готелю . Чути також все, що відбувається у сусідніх номерах, навіть вірування телефону.",7.9,10.0,ungweiser.uk.html
Зручно та колоритно,"Дуже зручне розташування : 25 хвилин пішки до ЖД вокзалу та 7 хвилин пішки до цента міста . В номері дуже чисто . Номер невеликий, але зручний . Смачна кухня в пабі, швидке обслуговування . Поїсти можно було навіть в 23 години.",В суботу вночі було шумно.,8.8,10.0,ungweiser.uk.html
Гарно.,"Шум пабу мені не заважав. Сніданок смачний, кава чудова.",Були збиті налаштування телевізора. І душова кабіна працювала з поливом води фіксованим в стелі зверху - без шлангу. :(((,7.9,10.0,ungweiser.uk.html
Чистий номер з ванною кімнатою та чудовим м'яким...,Чистий номер з ванною кімнатою та чудовим м'яким двоспальне ліжком,"Незручний душ . Він являє собою закріплений під стелею розсіювати напрям якого не можливо коригувати . Потік води направлений врізнобіч, а не по центру, що робить приймання душу не настільки приємною процедурою, як мало б.",7.5,10.0,ungweiser.uk.html
"Таке враження, що готель то лиш приставка до пабу та...",Nan,"Таке враження, що готель то лиш приставка до пабу та пивоварні...Хоч і попереджали що сніданок з 9:00, проте після дев'яти тільки починає сходитись персонал. Розраховуйте, що про ваш сніданок не попередять наступну зміну і це для них сюрприз((",7.9,10.0,ungweiser.uk.html
Розташування.,Розташування. Чиста та біла білизна. За проханням принесли дод ковдру. Тепло.,"Дуже погано прибраний номер . В ванній волосся . На пультах пилюка . По стінах розчавлені комарі . Враження не дуже . Претензія тільки до чистоти . І одного малого рушника замало (. Телевізор не працював . Зверталися до адмін, не виправили.",8.3,10.0,ungweiser.uk.html
"Зручне розташування, помірний комфорт, смачне домашнє пиво, привітний персонал.","Якщо Вас не цікавить рояль у номері, корт і басейн у готелі, то для Ужгорода кращого місця для перебування за параметром ціна-якість не знайти (на мою думку, ).",Nan,8.3,10.0,ungweiser.uk.html
Хороше розташування.,Хороше розташування. Чиста сантехніка і рушники. Наявність паркомісць.,"Наявність тарганів в номері. Душ вмонтований в стелю і не регулюється по висоті, оскільки в номері відсутня ванна, то це дуже незручно, бо інших варіантів освіжитися під час подорожі немає ...",6.7,10.0,ungweiser.uk.html
розташування зручне.,розташування зручне. кухня та пивоварня гарна. персонал привітний.,"повністю відсутні прибирання в номері . а ні сміття, а ні прибирання підлоги, а ні зміна білизни - не робилося ЖОДНОГО разу! рушників дуже малі за розміром . на 2 особи 3 рушника (1 для ніг і по одному "" для купання ""). для рук рушника немає . звукоізоляція через двері дуже слабка . (через коридор відпочивала Шумана компанія - неможливо було спати . чутно як під боком )",6.3,10.0,ungweiser.uk.html
Все класно,Все класно,"Шикарний бар з life Musik . Рок і рок - Ролл . Є камера схову, якщо ви висилається і хочете ще залишити речі . Чисто . Номери маленькі, але якщо ви приїхали на екскурсію, то нащо хороми?",8.3,10.0,ungweiser.uk.html
Для зупинки на одну ніч -  дуже приємне місце),"Цікавий концепт, жити в пивоварні це непересічна справа :) Світлі чисті номери . заселилися близько 23.00 (попередньо повідомили про це готель) і все пройшло гарно, навіть пива налили, хоч бар вже був закритий )","Мінуси: - водопоглинання, вірніше його відсутність . Коли зранку мили сусідній номер, то здавалось, що швабр гупає прямо над головою . Не знаю на скільки комфортно було б з працюючим баром, бо ми заселилися вночі і поїхали зранку, коли там ще було пусто . - в душовій була лише велетенська лійка зі стелі, що не дуже зручно, коли, наприклад, не планував мочити голову . Але душ приємний, без запахла грибка і тд - не завернули уваги, що виселення в 11 і на чек - Іні нас про це не попередили . Думали стандартно в 12 . Трохи через це затрималися з виходом, але плату за це з нас не знімали )",9.0,10.0,ungweiser.uk.html
Були тут вдруге.,"Були тут вдруге. Може в номерах не вистачає столика, але для нас це було не принципов. А реберця в ресторані у них взагалі неперевершені.","Не можливо поснідати раніш дев'ятої години - це не дуже зручно. Та коли пішов дощ, нам потрібно було прикрити вікно, бо вода текла у номер.",9.6,10.0,ungweiser.uk.html
