title,pos_text,neg_text,ratingValue,bestRating,hotel
"Невисокі ціни в кафе, дуже ввічливий консьєрж, спілкування з...","Невисокі ціни в кафе, дуже ввічливий консьєрж, спілкування з ним було приємнішим ніж з адміністратором, яка поселяли в готель.","Зависока ціна для таких номерів. Стара техніка, частина меблів, душ. На рецепції літній пані не вистачає ввічливості та виховання.",3.8,10.0,druzhba-uzhhorod.uk.html
1. Краєвид з вікон і на гори.,1 . Краєвид з вікон і на гори . 2 . Хороша ванна - кімната . 3 . Ввічливий персонал . 4 . Високі стелі . 5 . Наявність швейцара . --- 1 . Landscape with a windows and mountain views . 2 . A good Bath room . 3 . Friendly staff . 4 . High ceiling . 5 . available Norman.,"1 . Брудні номери, килими, матраци . 2 . Старі, ремонтована меблі . 3 . Запах їжі (різної) по всіх території готелю . 4 . Погані сніданки (жирна, не смачна їжа). 5 . Дуже виключно, провалені штори, засмальцьовані фіранки і вікна . 6 . Відсутність звукоізоляції . 7 . Практична відсутність Wi - Fi . --- 1 . Dirty: Rooms, Carpet, Presses . 2 . Old, Repair Future . 3 . The Smell of food (different) in all areas . 4 . Poor Breakfast (fat, not Taste food). 5 . Very Dusty, turned holes of Curtain, Grease windows . 6 . black of sound inhalation . 7 . The practical Absence of Wi - Fi.",6.3,10.0,druzhba-uzhhorod.uk.html
харчування у цьому готелі дужу хороший,харчування у цьому готелі дужу хороший,Nan,6.7,10.0,druzhba-uzhhorod.uk.html
- Гарний вид з вікна ,- Гарний вид з вікна - Доволі чисто,"- Готель ""совкового"" типу - Відсутність інтернету в номері. В холі він теж доволі сумнівний",7.1,10.0,druzhba-uzhhorod.uk.html
сподобалось що був включений сніданок в ціну номера,сподобалось що був включений сніданок в ціну номера,Nan,8.8,10.0,druzhba-uzhhorod.uk.html
"Старезні меблі,  страшно відкривати балкон і вікна,  люди...",Nan,"старезні меблі, страшно відкривати балкон і вікна, люди вище 175 см не помістяться на ліжках, ноги писатимуть",4.6,10.0,druzhba-uzhhorod.uk.html
Дуже професійний і ввічливий персонал,Дуже професійний і ввічливий персонал,Nan,8.8,10.0,druzhba-uzhhorod.uk.html
"розташування готелю, привітний персонал","розташування готелю, привітний персонал",за 3 ночі я став експертом з пошуку комарів,6.3,10.0,druzhba-uzhhorod.uk.html
"отель Советского типа, холодно в номер",Nan,"отель Советского типа, холодно в номер",3.8,10.0,druzhba-uzhhorod.uk.html
"Все сподобалось , дуже чисто ,затишно ,все на рівні.","Все сподобалось , дуже чисто ,затишно ,все на рівні. Номер не великій ,але все є . Все старалися , робили так як мені зручно .","під ранок трішечки засмутив шум під дверима, прибиральниця в 5 чи в 6 годині розбудила , я розумію що потрібно прибирати, але не хочеться це чути .",7.1,10.0,gotel-antonio.uk.html
Дуже чистий та затишний готель .,"Дуже чистий та затишний готель . Рушники нам замінили після першої доби перебування . Привітний персонал, допомагають у всьому . Рекомендую",Такого немає ),10.0,10.0,gotel-antonio.uk.html
Ідеальний варіант,"Зручно залишатись на ніч перед перетином кордону, надзвичайно чисті і просторі номери, ввічливий персонал . сніданки можна попередньо замовити з вечора, ми дуже рано виїжджали, нам пішли на поступки і кухню відкрили раніше, щоб приготувати нам сніданок","Такого не було, все супер! До речі, на першому поверсі готелю є супермаркет та сімейне кафе, в якому дуже смачно готують.",10.0,10.0,gotel-antonio.uk.html
Новий готель в затишному місці.,"Новий готель в затишному місці. Номери чисті, добре облаштовані.",Сніданок не включений у вартість з обмеженим вибором . У ванній кімнаті слайд поставити хоча б тумбочку: ),9.6,10.0,gotel-antonio.uk.html
Дуже зручно було відпочивати.,"Відчуття, ніби всі навколо тебе стараються, щоб ти був задоволений перебуванням у даному готелі . Ідеальна чистота . Вийшов погуляти - а у тебе вже все прибрано і постіль змінено на нову . Очевидно, що власники та персонал, який вони підібрали дуже турбується, щоб їхнім гостям тут максимально зручно . І це приємно . Нова сантехніка . Кондиціонер можна налаштувати на тиху та не надто потужну роботу Нані . Комарів вночі не було . Телебачення з багатьма каналами, навіть такими, як Футбол 1 та Футбол 2 . У цьому ж будинку є кафе та продовольчий магазин - нікуди далеко йти не треба . Поряд залізничний та авто - вокзали . Але ми прибули власним транспортом . Парковка невеличка, однак до нас одразу вийшли і показали, де залишити свій автомобіль.","В кафе довго чекати на замовлення. Трохи важко знайти сам готель - гугл чомусь повів нас через двір, рух через який було перекрито. Трохи далеко до центру, але це Ужгород - відстані тут невеличкі. Після прибирання чомусь не спрацьовував наш ключ, довелося спускатися назад на перший поверх до адміністратора, яка проблему вирішила за кілька секунд.",10.0,10.0,gotel-antonio.uk.html
"Якщо Ви шукаєте комфорт , стерильну чистоту та ідеальне...","Якщо Ви шукаєте комфорт, стерильну чистоту та ідеальне обслуговування - неодмінно зупиніться в даному готелі . Вам запропонують допомогу із багажем, а також одразу вирішать будь - яку проблему . Професійні меблі, сучасний інтер'єр, наповнення номеру як у 5 готелі . Дуже ввічливий персонал, який переживає за кожного гостя . Якщо Ви вперше у місті - підкажуть, що відвідати та куди піти . На першому поверсі затишна сімейна кафешки із смачними сніданками й не тільки.",Nan,10.0,10.0,gotel-antonio.uk.html
Оптимальне співвідношення ціна-якість. Якщо своєю машиною - дуже зручно.,"Сучасний інтер‘єр, бездоганна чистота. Привітний та готовий допомогти персонал. 10 хв машиною до центру міста. Смачні сніданки в кафе на першому поверсі.","Неприємно вразило місце, бо готель знаходиться поміж житлових будинків і під'їжджати до нього треба по суцільних ямах та неосвітлених дворах (обіцяли що за кілька тижнів вирішиться питання заїзду із траси )",9.2,10.0,gotel-antonio.uk.html
"Новий готель, сучасний стиль, просторі номера, смачні...","Новий готель, сучасний стиль, просторі номера, смачні сніданки, чисто, привітний персонал",В номері не вистачає холодильника та не надто зручне розташування,8.8,10.0,gotel-antonio.uk.html
Такий готель точно можно радити!,"Новий, сучасний готель. Дуже чисто, є все необхідне, зручні ліжка, дуже тихе місце, парковка, магазин та ресторанчик в одній будівлі, привітний персонал.",немає такого,10.0,10.0,gotel-antonio.uk.html
Ми рекомендуємо всім цей готель,"Сніданок був смачний і ситний, номер був чистим , просторим, були навіть халати і зручні одноразові тапочки і ще різні, але по потребі дрібнички. Персонал був дуже привітним.",Такого не було,10.0,10.0,gotel-antonio.uk.html
Дуже чисто та охайно.,"Дуже чисто та охайно. У готелі є магазин та чудове кафе. дуже ввічливий персонал, усі питання та проблеми вирішуються швидко.","у Номері нема холодильника, а це було б дуже доречно. У кімнаті також є лише 1 стілець, а кімната на 3 людини.",8.3,10.0,gotel-antonio.uk.html
Просто супер!,"Настільки стильний, чистий та сучасний готель, що аж не віриться, що це в Ужгороді . Просто чудовий! В реальності симпатичні, ніж тут на фото . В номері є кондиціонер! Дуже чисто, прибирали щодня . Разом з рушниками дають халати і капці . На території готелю є магазин і кав'ярня - дуже зручно.",Nan,10.0,10.0,gotel-antonio.uk.html
Номер чистий та затишний.,Номер чистий та затишний. Готель добре укомплектований. На території є кафе та маркет.,"Персонал жахливий, в кафе немає доставки, готель розташований в мікрорайоні, відповідно на території весь час перебувають безхатченки . засмутило.",6.7,10.0,gotel-antonio.uk.html
Чудовий новий готель.,Чудовий новий готель. Дуже зручні ліжка та матраци. Персонал надає всю необхідну інформацію та відповідає вчасно на запити. В приміщенні чудовий ресторан зі смачною кухнею.,Nan,9.2,10.0,gotel-antonio.uk.html
Дуже зручно розташований готель - рівновіддалений на 2-3...,"Дуже зручно розташований готель - рівновіддалений на 2-3 хвилини ходу від ЗД та автобусного вокзалу. Новий, чистий, сучасний, комфортний - оберу цю місцину наступного разу без сумнівів.",Не вистачає ліфту - підніматися на поверхи літнім людям східцями не дуже зручно.,9.2,10.0,gotel-antonio.uk.html
Несподівано хороший готель неподалік залізничного вокзалу,"Новий готель з дуже приємним персоналом. Хороші і чисті номери. Є непогане кафе зі смачною кухнею, де можна і легко поснідати і ситно повечеряти. Також в будівлі готелю є продуктовий магазин, який, як і кафе працює до 23:00.",Nan,9.6,10.0,gotel-antonio.uk.html
Гарний готель біля вокзалу. ,"Можна залишити речі на рецепції. 
Дуже чисто, прибирають щодня. 
Комфортне ліжко. 
Магазин на першому поверсі. 
Хороший ресторан внизу. 
Поряд з вокзалом і автостанцією.","Немає підставки в душі . Вздовж вікон ввечері горять гірлянди, трохи заважає спати . Вибір у меню сніданків дещо обмежений . Було б добре давати знижку на ресторан для гостей готелю.",10.0,10.0,gotel-antonio.uk.html
Чудовий готель та приємний персонал!,"Фото відповідають дійсності. Дуже чистий номер, який перевершив очікування! Класно також, що на першому поверсі розташований магазин та кафе. 15 хв до центру міста - приємна прогулянка.",Nan,10.0,10.0,gotel-antonio.uk.html
Рекомендую!!!!,"Готель дуже гарний. Величезні кімнати, нові меблі, чисто, гарно",Гірше за все це місцерозташування - в дворах біля смітника . Але...поряд з ЖД вокзалом та пішохідним мостом,8.8,10.0,gotel-antonio.uk.html
Привітний персонал.,"Привітний персонал. Заселили  в лічені хвилини. Номер просторий, сучасний, чистий.  На території готелю є кафе в якому ми вечеряли та снідали. Меню та якість приготування сподобалось. В готелі також є магазин. В цілому готель сподобався. Радимо його відвідати .",Nan,9.6,10.0,gotel-antonio.uk.html
Класний готель Антоніо,"Хороші номера з новими меблями з білосніжною чистою білизною, з бездоганною звукоізоляцією з усім новим, що в ванній кімнаті . Рекомендую для відвідин.","Готель Антоніо оточений старими будівлями часів комунізму. В момент перебування в середині готелю здається, що ти десь в європейському готелі (все нове все гарне) виходиш на вулицю і ""бац"" розчарування ти знову в Україні.",9.2,10.0,gotel-antonio.uk.html
"Вибачте, що не попередили про незайве: (","Вибачте, що не попередили про незайве: (Можливо, цей відгук компенсує втрати . Дуже цікаво чому Ви самі не скористалися функцією "" незайве "" . Не прийміть з нашого боку це як зухвальство, але таким чином Ви сплачуєте% . Процвітання Вам і високих рейтингів!!!",Nan,10.0,10.0,gotel-antonio.uk.html
Чудове місце,"Затишний готель з гарними номерами та сучасною технікою. Приємно бачити, що господарі не економлять на техніці. Було комфортно та змогли гарно виспатися.",Nan,10.0,10.0,gotel-antonio.uk.html
Чудовий новий готель!,"Були в Ужгороді проїздом . Обрали готель за порадою друзів . Все чудово! Готель новий, просторі номери, дуже чисто, привітний персонал . Наступного разу зупинятимемося тут знову . Дякуємо!","Даний відгук не стосується власне готелю. Зверніть увагу на роботу ресторану. Очікували з малою дитиною сік і морозиво (подали без особливої презентації - звичайні кульки) цілу годину!((( Єдина дівчина-офіціант об'єктивно не могла впоратися при повному залі гостей, хоча й робила все можливе. Вона просила кухню відпустити наше замовлення (одне лише морозиво!!!) і отримала відмову.  Власники, не економте на персоналі! Інакше такий сучасний новий ресторан залишиться без клієнтів.",9.2,10.0,gotel-antonio.uk.html
Готель європейського рівня,"Дуже гарний,новий та чистий готель з привітним персоналом.Працівники з увагою ставляться до своїх гостей,що робить перебування комфортним. Ліжко дуже зручне,в номері є все необхідне. Ресторан,що від готелю порадував гарною подачею та смачною кухнею. Великим плюсом також є  дитячий куток, що знаходиться в ресторані.Рекомендуємо!",Nan,10.0,10.0,gotel-antonio.uk.html
Смачна кухня.,"Смачна кухня. Дуже привітний персонал. Є всі зручності. Номери чисті та просторі, все доглянуте. Дуже сподобалось перебування у цьому готелі. Рекомендую.",Nan,10.0,10.0,gotel-antonio.uk.html
"Раджу отель тим, хто цінує сервіс, комфорт, затишок і пішохідні прогулянки (1,5 км до центру)","Дуже сучасний дизайн у Скандинавському стилі, дорога і якісна сантехніка. В Україні, можливо, вперше побачив таку сантехніку. Дуже привітний та зацікавлений в гарному настрої гостей персонал. Безкоштовна парковка. Відеокамери та охорона. Зручно, що на 1-му поверсі отеля був невеликий супермаркет та сімейний затишний ресторан.","Частина дороги на під'їзду до готелю (метрів 50-70) була в поганому стані . сніданки були якісні та недорогі, але з маленьким вибором з 3-х сніданків (або млинці з повидлом, або мюслі, або яєшня + сосиски та грінки). Треба додати ще кілька та більш наповнених.",9.2,10.0,gotel-antonio.uk.html
Місце знаходження - ідеально;,"Місце знаходження - ідеально;
Персонал - чуйний, питання вирішує моментально; 
Номер - просторий, світлий, чистий( створено відчуття що ти перший гість у цьому номері), виняток немає міні бару(холодильника), за бажанням символічно можно замовити сніданок",Nan,9.6,10.0,gotel-antonio.uk.html
Новий готель із шикарним ремонтом та веселим персоналом.,Новий готель із шикарним ремонтом та веселим персоналом.,"Ми очікували, що сніданок буде із 7 години, але він був із 8. Тим не менше, персонал підготував сніданок раніше 8-ої години.",9.6,10.0,gotel-antonio.uk.html
Все сподобалось.,"Все сподобалось . В номері чисто, зручні матраци, нові меблі, в ванній кімнаті дорога сучасна сантехніка . На першому поверсі розташовані магазин, ресторан . Там подаються дуже смачні страви європейської, італійської кухні, помірні ціни, великі порції . Обслуговують швидко, професійно . Якщо приїдемо до Ужгорода, зупинимося в Antonio.",Nan,10.0,10.0,gotel-antonio.uk.html
"Чистий та просторий номер, ванна кімната на високому рівні.","Чистий та просторий номер, ванна кімната на високому рівні. Привітний адміністратор.","Контингент з прилеглих будинків, який збирається біля магазину на першому поверсі, щоб випити пива. Потім вночі це закінчилося досить голосною музикою під вікном.",7.5,10.0,gotel-antonio.uk.html
Новий сучасний отель.,"Новий сучасний отель . привітний персонал . Чисто, комфортно . Кафе і супермаркет у приміщенні готелю.",Nan,10.0,10.0,gotel-antonio.uk.html
Отель просто супер!,+,- один вхід з магазином,10.0,10.0,gotel-antonio.uk.html
"Новий, сучасний та зручний готель.","Новий, сучасний та зручний готель . Є свій ресторан, магазин і охороняємо парковка . Дуже привітний персонал.",Не було,9.2,10.0,gotel-antonio.uk.html
"Номер затишний, чистий і дуже зручний.","Номер затишний, чистий і дуже зручний.",Nan,8.8,10.0,gotel-antonio.uk.html
Готель Antonio ,"Сучасний ремонт, якісна сантехніка, чисто та комфортно.",Nan,8.8,10.0,gotel-antonio.uk.html
"Новий, чистий готель.","Новий, чистий готель. Привітні люди.",Nan,9.6,10.0,gotel-antonio.uk.html
Luxury hotel in Uzhgorod,"Готель дуже новий і стильний. Обладнаний по останньому слову техніки і якості оздоблення. 
Персонал та власник неймовірно турботливі та уважні!",Nan,10.0,10.0,gotel-antonio.uk.html
"Великі, просторі номери, затишне місце поруч з ЖД вокзалом ...","Великі, просторі номери, затишне місце поруч з ЖД вокзалом та кордоном",Nan,8.8,10.0,gotel-antonio.uk.html
Гарний відпочинок.,"Дуже чистий отель, приємний та ввічливий персонал . Всім рекомендую кухню . Дуже смачна їжа та кава.",Nan,10.0,10.0,gotel-antonio.uk.html
Супер!,Супер!,Все!,10.0,10.0,gotel-antonio.uk.html
