title,pos_text,neg_text,ratingValue,bestRating,hotel
"Чисто, приємний персонал та чиста постіль.","Чисто, приємний персонал та чиста постіль. Смачний сніданок.","Платний шампунь та гель для душу. Відсутність безкоштовної води в номері. Грибок у душовій кабіні, несправність дверей душу, забита каналізація душової кабіни.",7.9,10.0,argo-uzhgorod-hotel.uk.html
Дуже чисті та комфортні номера.,Дуже чисті та комфортні номера . постільна білизна виправна і приємно пахне! Смачні сніданки та привітний персонал . Ціни приємно вразили) ) зупинялись тут двічі і дуже задоволені,Nan,10.0,10.0,argo-uzhgorod-hotel.uk.html
Не рекомендую,Nan,"Диван жахливий, розламаний . Сніданок окрема тема . Ми подорожували 4, троє дорослих і дитина 3 років . Сніданок принесли лише на 3 дорослих . Офіціант запропонувала з напоїв каву, чай, кефір, молоко, сік і воду . кожному вибір 2 напої, я попросила каву і молоко для дитини, мені відмовили, оскільки такі варіант як кава і молоко не дають, каву і сік або кава і вода можна . На моє прохання з звернути увагу, що я з дитиною, що сік навіть дорожчий по вартості за молоко, нічого не дало . Я відмовилась від кави на користь молока звичайно, але це відбило всі бажання рекомендувати цей готель друзям і повернутись туди ще раз . Здоровий глузд тут відсутній у персоналу.",5.0,10.0,argo-uzhgorod-hotel.uk.html
Дуже приємний персонал.,"Дуже приємний персонал. Смачні сніданки, на вибір. Дійсно дуже смачні. В номері чисто і затишно.","Не відкривались мансарді вікна, посеред ночі включали кондиціонер . Це єдине, що викликало дискомфорт.",8.3,10.0,argo-uzhgorod-hotel.uk.html
Класно! Дякую!,"Готель сподобався. Ідеальне співвідношення ціна-якість. Приємно вразила чистота білизни, а наявність у приміщенні кафетерію зі смачною кухнею та помірними цінами додала додаткових бонусів готелю. Особлива подяка за сніданки, які входять у вартість проживання: ситно, смачно і навіть корисно!))) Раджу тим, хто планує поїздки в Ужгород!",Nan,8.8,10.0,argo-uzhgorod-hotel.uk.html
Місцерозташування готелю відносно центру зручне (до 20 хв...,"Місцерозташування готелю відносно центру зручне (до 20 хв пішки до пішохідного мосту). Легко знайти та проїхати . Сніданок смачний, є вибір різних варіантів сніданків . сніданок входив вартість номера . В номері загальному чисто . Є кондиціонер, бар - холодильник . Персонал ввічливий.","Готель розташований безпосередньо біля дороги з інтенсивним рухом (зранку шум). Парковка вміщає 3-4 автомобілі. При бронюванні вказав необхідність парковки, по факту прийшлось паркуватись біля дороги. Жив в люксі у номері дуже не вистачає розеток біля ліжка (надзвичайно не зручно) та шафи (замість шафи 2 стійки для одягу) речі прийшлось складати на дивані. Дахові вікна надзвичайно важко відкриваються.",6.3,10.0,argo-uzhgorod-hotel.uk.html
Привітний персонал на рецепції.,"Привітний персонал на рецепції. Зручне розташування, 10 хв до набережної. В готелі є ресторан, де непогано готують, ціни демократичні.","Дівчина, що обслуговує ресторан поводиться так, ніби до неї додому завітали небажані гості. Можна бути трошки привітніше, посміхатись. Старенькі обшарпані ролети на вікнах, пліснява у душовій кабіні.",9.6,10.0,argo-uzhgorod-hotel.uk.html
"смачний сніданок, зручний номер і затишна постіль, привітний ...","смачний сніданок, зручний номер і затишна постіль, привітний персонал . Нормальна звукоізоляція.","Трохи далекого від центру, недалеко цвинтар і шиномонтаж . Трохи пошарпані меблі в номері . Номер не відповідав класу люкс . Якщо вам потрібно залишитись ще на кілька годин, потрібно платити за повну добу, хоча в більшості готелів можна оплатити півдоби принаймні.",7.1,10.0,argo-uzhgorod-hotel.uk.html
Але для 1 ночівлі непогано.,"Сніданок смачний, постіль чиста, привітний персонал.","Ванні приналежності за окрему платню ( наприклад, шампунь), за феном треба йти на рецепцію, ванна кімната просить ремонту.(",7.1,10.0,argo-uzhgorod-hotel.uk.html
Дуже нормальний готель!,"Дуже нормальний готель! Ми їхали сім'єю  2 дорослих і двоє дітей проїздом, ночували 1 ніч. є парковка, нормальні сніданки на вибір.",Все було добре!,7.5,10.0,argo-uzhgorod-hotel.uk.html
"Вірогідно, що зупинюся у цьому готелі ще раз для ночівлі.",Достатньо прийнятний готель як для зупинки на 1-2 ночі. Дуже привітний персонал готелю.,"В номері, як для зими, було дещо прохолодно, в душовій кабанів "" живе "" грибок, що лишає не Гед приємні враження від приймання душу.",7.9,10.0,argo-uzhgorod-hotel.uk.html
В цілому ціна/якість майже співпали.,"Комфортний номер,великий. Ліжко зручне. Ортопедичний матрац. Телевізор. Привітний персонал готеля. Поруч з готелем великий супермаркет, є кафе та ресторан. Також міський ринок.","Третій поверх. З валізами було важко підніматись.  Відстань від готеля до центру міста більша, ніж заявлено на сайті.",7.5,10.0,argo-uzhgorod-hotel.uk.html
Гарно для ночівлі 1-2 дні.,Зустріли вночі. Розмістили. Досить чисто та комфортно. Смачний сніданок.,"Сніданок подається з великою кількістю додаткових інгредієнтів до каші, або млинців . Було б добре, якби в гостів запитували, чи вони хочуть посилку корицею, шоколадом до того, як це зробити . Це було б виявленням доброго тону . Бо сам сніданок смачний, а я і мої члени родини любимо страви в чистому вигляді . Дякую Також Варто звернути увагу на душові кабіни . Дещо підтягти ролики в дверцятах, поновити ущільнювачі, бо воно вже втомилося і дає незручності у користуванні.",7.9,10.0,argo-uzhgorod-hotel.uk.html
"Загалом отель сподобався. Хоч і пошарпаний ремонт, але чистий та затишний.","Хоч отель і був трохи втомленим у плані ремонту, але було дуже чисто . В нашому номері був бар, і що нас більше всього здивувало, вартість його вмісту була майже аналогічна як в магазині поруч . Номер просторий, чистий . Сніданок теж здивував . З одного боку був відсутній класичний шведський стіл, з іншого боку було меню, з якого можна було собі обрати страви . Розміщений отель теж у непоганому місці . Не далеко від центру, і поруч є великий гіпермаркет.","Як вже вказував, ремонт був давно, і трохи розносився . Двері заїдали у крайньому положені, а балконні двері не щільні були . Стосовно персоналу, то довелось два рази пояснювати, що мені необхідний чек і акт виконаних робіт, аби мені компенсувало підприємство витрати .... або персонал і справді з першого разу не розумів про що річ...або намагались з'їхати з питання (аби не проводити витрати через касу).",8.8,10.0,argo-uzhgorod-hotel.uk.html
Гарний готель з поганим персоналом,"Чистота номеру, зручне ліжко, гарне розташування готелю.","Усе враження від готелю зіпсував персонал, зверхнє ставлення, адміністратора ніколи не було на місці, вдень відсутня вода!!! Працівники кафе - то взагалі жах! Враження, що ми їм щось винні, краще б ми їх не відволікали від особистих справ, навіть меню не спромоглись принести...",5.8,10.0,argo-uzhgorod-hotel.uk.html
Переночувати,Не висока ціна в готелі та кафе,"Відсутня ковдра чи щось на зразок .. Дивно . Старий ремонт, старі рушники, засоби для душу в дозаторів (ріденькі - ріденькі мило) Персонал намагався бути привітним, проте увечері мабуть втомилися, ду-у-уже натягнута ввічливість . Бульйон подають в Піацці, наче чашка .. Є сумніви щодо заявлених 300 гр, салат цезар на 70% з листя салату.",5.4,10.0,argo-uzhgorod-hotel.uk.html
Рекомендую. Співвідношення ціна-якість витримано на всі 100%.,"Номер чистий та комфортний, наявний кондиціонер, міні - бар (ціни доступні), центр у пішій доступності (близько 15 хв до набережної річки Уж), наявна невелика парковка на 3 місця, поруч теж можна паркувати автомобіль . Персонал уважний та реагує на прохання чи потреби . На сніданок запропоновано близько 5 різних варіантів страв (яєшня, млинці, тости і тп), здивувало, що до сніданку додається два напої, можна було обрати сік і чай чи каву, наприклад . сніданком, в принципі, можна було вдосталь насититися . Готель чудовий, рекомендую!","Здивувало те, що варіанти сніданку дуже різні за кількістю: яєшні з беконом було набагато менше ніж, наприклад, млинців із ворогом . Трішки незручно, що в номері не було фену (декому він таки потрібен) Але ці мінуси лише, якщо вже дуже хотіти шукати мінуси: )",9.6,10.0,argo-uzhgorod-hotel.uk.html
"Чистий номер та білизна, ввічливий персонал.","Чистий номер та білизна, ввічливий персонал. Оскільки ми виїжджали дуже рано (о 5 год. ранку) то сніданок нам зібрали заздалегідь - млинці з сиром надзвичайно смачні! Велике спасибі!","Велика кількість москітів, перед сном необхідно було провести демократизацію) ) )",10.0,10.0,argo-uzhgorod-hotel.uk.html
"Затишно, спокійно","Чисто. Гарний, сніданок (на вибір). Тихо. Зручний, достатньо жорсткий матрац.",малувато пішаків в шафі + один з них зламаний (ліпше його викинути - зламані речі неприємні) Немає куди ставити засоби гігієни та догляду в душовій кабінці.,8.3,10.0,argo-uzhgorod-hotel.uk.html
"Надзвичайно приємний персонал, дівчинка на рецепції одразу ж...","Надзвичайно приємний персонал, дівчинка на рецепції одразу ж допомагала з усіма питаннями та комунікаціями! Дуже смачні сніданки! Розташування у тихому спальному районі - великий плюс! Дуже рекомендую!",Nan,9.2,10.0,argo-uzhgorod-hotel.uk.html
Була приємно вражена!,"Хочу відзначити адміністратора! Усі побажання виконувались протягом 2-х хвилин! Анюта, якби у готелях були адміністратори, хоча б на 50% схожі на вас, негативних відгуків у банкінгу не було б взагалі! Готель дуже чистий . Приємно здивувала білосніжна постіль, величезна кількість рушників і чиста ванна! В Ужгороді - тільки до вас! Писали, що сніданки не дуже - МО вередливі чоловіки прийшли зі сніданку ситі і з задоволеними посмішками! Дякую!",Nan,10.0,10.0,argo-uzhgorod-hotel.uk.html
Було зручно і затишно в цьому готелі.,"Було зручно і затишно в цьому готелі.   Дуже все продумано і організовано. Хоч замовляли звичайний двомісний номер, проте послуги були ніби ми в Люксах.",Nan,10.0,10.0,argo-uzhgorod-hotel.uk.html
"Тихо, затишно, тепло. Приємний персонал.","Чистота - вище всіх сподівань! Тепла підлога у ванній кімнаті - супер . Тихо, затишно . Комфортне ліжко зі зручним матрацом - що ще потрібно? Рекомендую . На першому поверсі - невеличке кафе . Смачно і недорого . замовляли чай в номер.",Nan,10.0,10.0,argo-uzhgorod-hotel.uk.html
"Ввічливий, привітний персонал.","Ввічливий, привітний персонал.","Номери потребують ремонту, особливо сан вузли.",7.1,10.0,argo-uzhgorod-hotel.uk.html
"Непоганий готель з хорошим сніданком, але запах в ванній кімнаті справив неприємні враження","Хороший сніданок, просторий номер, чисто","Дуже неприємний запах у ванній кімнаті , ліжко не дуже зручне, тоненька ковдра",6.7,10.0,argo-uzhgorod-hotel.uk.html
Ідеальне місце переночувати перед довгою поїздкою закордон,"Класичний B & B за притомна ціну . Персонал ввічливий, місце тихе, незважаючи на розташування на Капуанський.",Nan,7.9,10.0,argo-uzhgorod-hotel.uk.html
Легко дістатись до Ужгородського замку,Легко дістатись до Ужгородського замку,"Гарне розташування, близько до центру міста, привітний персонал.",10.0,10.0,argo-uzhgorod-hotel.uk.html
Чудове співвідношення ціна -якість!,"Чудове співвідношення ціна - якість! ввічливий персонал! Ідеально для того, для відрядження!",Nan,9.6,10.0,argo-uzhgorod-hotel.uk.html
"Ціна досить не маленька,  а потрібних побутових речей немає. Також дуже погана звукоізоляція.",Nan,"В номері відсутні тапочки, фен .",5.4,10.0,argo-uzhgorod-hotel.uk.html
Персонал дуже приємний.,Персонал дуже приємний. Ціни в кафе дуже доступні. Смачний сніданок. Все чудово. Рекомендую.,Nan,8.8,10.0,argo-uzhgorod-hotel.uk.html
Не було щоденного виносу сміття,Nan,Не було щоденного виносу сміття,8.3,10.0,argo-uzhgorod-hotel.uk.html
"Все ОКК, мені сподобалось, раджу іншим","Все ОКК, мені сподобалось, раджу іншим",Nan,9.6,10.0,argo-uzhgorod-hotel.uk.html
Все чудово,Nan,Фен для волосся відсутній,10.0,10.0,argo-uzhgorod-hotel.uk.html
У нас виникли невеликі проблеми в перший день на що персонал дуже чітко відреагував. Дякуємо!,Для нас було достатньо,"Цілодобовий рух транспорту,але це персонал готелю змінити ,на жаль,не взмозі",7.5,10.0,argo-uzhgorod-hotel.uk.html
Все добре окрім персоналу на ресепшн. Це те на що рекомендуємо Вам звернути увагу.,"смачно, вибір достатній. Швидко.","Персонал, на прохання допомогти у вирішенні питань з сантехнікою, яка не працювала, був не чемний та не компетентний.",7.9,10.0,argo-uzhgorod-hotel.uk.html
"Сніданок дуже смачний, персонал привітний та приємний","Сніданок дуже смачний, персонал привітний та приємний",Nan,10.0,10.0,argo-uzhgorod-hotel.uk.html
сніданок чудовий чисто охайно,сніданок чудовий чисто охайно,Nan,9.6,10.0,argo-uzhgorod-hotel.uk.html
Все чудово.,Все чудово.Чисто.Затишно.,Nan,7.5,10.0,argo-uzhgorod-hotel.uk.html
Норм.,Харчування,"Вода пропадає. Нема фену в номері. Погана шумоізоляція, сред ночі чути машини з вулиці.",7.1,10.0,argo-uzhgorod-hotel.uk.html
"Інтер'єр відповідає ціні, проте має бути чисто",Привітний персонал,Не дуже чисто,6.7,10.0,argo-uzhgorod-hotel.uk.html
- комфортний і затишний номер ,"- комфортний і затишний номер - дуже смачно в ресторані, і ціни приємні:))",Nan,9.6,10.0,argo-uzhgorod-hotel.uk.html
Арго +,Чистота в номері та готелі.,"Близьке розташування до проїжджої автодороги, гул машин.",6.7,10.0,argo-uzhgorod-hotel.uk.html
"Комфортно, зручно та тихо. Смачні сніданки.",Відпочивали сім'єю. Все сподобалось. Привітний персонал. Смачні сніданки. Найкраще співвідношення ціна-якість),Nan,9.2,10.0,argo-uzhgorod-hotel.uk.html
"Все сподобалося. Персонал привітний. Були неполадки з кондиціонером у номері, то відразу їх вирішили",Сніданок сподобався. Було запропоновано кілька варіантів. Тож можна було обрати на свій смак,Nan,9.6,10.0,argo-uzhgorod-hotel.uk.html
працівниця бару не спілкується українською мовою,Nan,працівниця бару не спілкується українською мовою,7.5,10.0,argo-uzhgorod-hotel.uk.html
Все супер.,"Сподобалась кухня, все було дуже смачно! Номера комфортні та чисті.",Балкон не надто надійний.,7.5,10.0,argo-uzhgorod-hotel.uk.html
"привабливий персонал, зручне розташування готелю, ціна ...","привабливий персонал, зручне розташування готелю, ціна відповідає якості номерів.",У номерах не було засобів гігієни (лише рідке мило).,8.8,10.0,argo-uzhgorod-hotel.uk.html
Чисто.,Чисто. Доброзичливий персонал.,погана звукоізоляція між номерами,7.1,10.0,argo-uzhgorod-hotel.uk.html
"Затишок, комфорт, велике ліжко, привітний персонал,...","Затишок, комфорт, велике ліжко, привітний персонал, близькість до центру міста.",Шум вулиці на мансардному поверсі.,8.8,10.0,argo-uzhgorod-hotel.uk.html
Дуже сподобалось.,"Дуже сподобалось . привітний і ввічливий персонал, смачна кухня.",Nan,10.0,10.0,argo-uzhgorod-hotel.uk.html
Сніданок пізній з 8.,Nan,Сніданок пізній з 8.00. Для бізнесу це не підходить,7.5,10.0,argo-uzhgorod-hotel.uk.html
Вечеря у номер!,Вечеря у номер!,відсутність лита: ),8.3,10.0,argo-uzhgorod-hotel.uk.html
Гарно годують,Гарно годують,"Втомлений життям матрац, надто сильно налаштоване опалення - вимкнув все й всеодно було некомфортно",6.3,10.0,argo-uzhgorod-hotel.uk.html
Просторий номер,Просторий номер,Несвіжа білизна та рушники,6.7,10.0,argo-uzhgorod-hotel.uk.html
Особливо вигідний варіант для короткотермінових подорожей до Ужгорода.,Гарне розташування - вокзал та центр недалеко.,Nan,8.8,10.0,argo-uzhgorod-hotel.uk.html
"Відпочивай й ні про, що не піклуючись.",Відносно близьке розташування до історичного центру. Просторі кімнати. Піклування персоналу. Включений у вартість сніданок у номері.,Nan,10.0,10.0,argo-uzhgorod-hotel.uk.html
